{
  "from": "did:cid:bagaaieras2jx67ejklsa4qmmsnnuxst7rc2vpdifzsic7r32p7zxmecybqga",
  "to": "did:cid:bagaaieravnv5onsflewvrz6urhwfjixfnwq7bgc3ejhlrj2nekx75ddhdupq",
  "relationshipType": "trusts",
  "context": "https://example.org/dtg/context/v1",
  "edgeId": "edge:example:from-to-trusts",
  "effectiveFrom": "2026-02-19T00:00:00Z"
}
